{
  "candidates": [
    {
      "anomaly_types": [
        "BULLISH_MOMENTUM",
        "MOMENTUM_SHIFT",
        "VOLATILITY_EXPANSION",
        "VOLUME_SPIKE"
      ],
      "candle_close_time": 1793373300000,
      "detected_at_utc_ms": 1793374095185,
      "inst_id": "ETH-USDT-SWAP",
      "metrics": {
        "atr": "12.2753",
        "bar_range": "19.02",
        "price": "2250.4",
        "raw_score": "55.58",
        "rsi": "57.03",
        "rvol": "2.68",
        "volume_zscore": "2.09"
      },
      "regime": "HIGH_VOL_CHOP",
      "scanner_score": "33.35",
      "signal_id": "ETH-USDT-SWAP:15m:1793373300000",
      "status": "PENDING",
      "timeframe": "15m"
    },
    {
      "anomaly_types": [
        "BREAKOUT",
        "BULLISH_BREAKOUT",
        "VOLATILITY_EXPANSION"
      ],
      "candle_close_time": 1793373300000,
      "detected_at_utc_ms": 1793374095185,
      "inst_id": "DOGE-USDT-SWAP",
      "metrics": {
        "atr": "0.0004",
        "bar_range": "0.0007",
        "price": "0.0763",
        "raw_score": "44.58",
        "rsi": "53.89",
        "rvol": "1.7",
        "volume_zscore": "1.03"
      },
      "regime": "HIGH_VOL_CHOP",
      "scanner_score": "26.75",
      "signal_id": "DOGE-USDT-SWAP:15m:1793373300000",
      "status": "PENDING",
      "timeframe": "15m"
    },
    {
      "anomaly_types": [
        "VOLATILITY_EXPANSION",
        "VOLUME_SPIKE"
      ],
      "candle_close_time": 1793373300000,
      "detected_at_utc_ms": 1793374095185,
      "inst_id": "BTC-USDT-SWAP",
      "metrics": {
        "atr": "335.1864",
        "bar_range": "555.2",
        "price": "77704.9",
        "raw_score": "39.37",
        "rsi": "49.12",
        "rvol": "2.4",
        "volume_zscore": "1.78"
      },
      "regime": "HIGH_VOL_CHOP",
      "scanner_score": "23.62",
      "signal_id": "BTC-USDT-SWAP:15m:1793373300000",
      "status": "PENDING",
      "timeframe": "15m"
    },
    {
      "anomaly_types": [
        "VOLATILITY_EXPANSION"
      ],
      "candle_close_time": 1793373300000,
      "detected_at_utc_ms": 1793374095185,
      "inst_id": "SOL-USDT-SWAP",
      "metrics": {
        "atr": "0.6626",
        "bar_range": "1.08",
        "price": "95.25",
        "raw_score": "20.37",
        "rsi": "36.53",
        "rvol": "1.8",
        "volume_zscore": "1.19"
      },
      "regime": "HIGH_VOL_CHOP",
      "scanner_score": "12.22",
      "signal_id": "SOL-USDT-SWAP:15m:1793373300000",
      "status": "PENDING",
      "timeframe": "15m"
    }
  ],
  "generated_at_utc_ms": 1793374095185,
  "market_regime": {
    "btc_atr_pct": "0.4314",
    "btc_ema_fast": "77354.99",
    "btc_ema_slow": "77354.99",
    "btc_price": "77704.90",
    "btc_rsi": "49.12",
    "details": {
      "atr_rank_percentile": 100.0,
      "candles_analyzed": 34,
      "is_ema_bear": false,
      "is_ema_bull": false
    },
    "detected_at_utc_ms": 1793374095185,
    "market_breadth_pct": "12.36",
    "multiplier": "0.60",
    "regime": "HIGH_VOL_CHOP"
  },
  "queue_size": 4,
  "schema_version": "1.1"
}